{
  "$schema": "https://json-schema.org/draft/2020-12/schema",
  "$id": "https://vtifoundation.org/schemas/decision-artifact.schema.json",
  "title": "Decision Artifact Reference Schema",
  "description": "Non-normative public reference interface for representing the result of a governance evaluation in the VTI Deterministic Governance Reference.",
  "type": "object",
  "additionalProperties": false,
  "required": [
    "schema_version",
    "decision_id",
    "request_id",
    "outcome",
    "authority_state_id",
    "evaluation_context_id",
    "evaluated_at"
  ],
  "properties": {
    "schema_version": {
      "type": "string",
      "const": "0.1"
    },
    "decision_id": {
      "type": "string",
      "minLength": 1,
      "description": "Unique identifier for the decision artifact."
    },
    "request_id": {
      "type": "string",
      "minLength": 1,
      "description": "Identifier for the proposed action or request that was evaluated."
    },
    "outcome": {
      "type": "string",
      "enum": [
        "permit",
        "deny",
        "additional_evidence_required",
        "additional_approval_required",
        "escalate",
        "unable_to_verify"
      ],
      "description": "Simplified public reference outcome vocabulary. This vocabulary is non-normative."
    },
    "authority_state_id": {
      "type": "string",
      "minLength": 1,
      "description": "Reference to the authority-state representation used in the evaluation."
    },
    "evaluation_context_id": {
      "type": "string",
      "minLength": 1,
      "description": "Identifier for the evaluation context, policy set, or implementation-defined ruleset used for the decision."
    },
    "evaluated_at": {
      "type": "string",
      "format": "date-time",
      "description": "Timestamp at which the evaluation result was produced."
    },
    "valid_until": {
      "type": [
        "string",
        "null"
      ],
      "format": "date-time",
      "description": "Optional timestamp after which the decision artifact should not be relied upon without reevaluation."
    },
    "integrity_reference": {
      "type": "string",
      "minLength": 1,
      "description": "Optional implementation-defined integrity or provenance reference associated with this artifact."
    },
    "execution_reference": {
      "type": "string",
      "minLength": 1,
      "description": "Optional reference to a downstream execution, transaction, receipt, or external system record."
    },
    "metadata": {
      "type": "object",
      "description": "Optional implementation-specific metadata. Consumers should not treat metadata as normative decision semantics."
    }
  }
}
